{
  "$schema": "../../../tools/schemas/fable2-gpu-static-xdk-method-inventory-v1.schema.json",
  "schema_version": "1.0.0",
  "corpus": "Fable II Native Renderer G1.6A",
  "phase": "G1.6A - Static XDK Method Recovery",
  "experiment_id": "EXP-STATIC-XDK-001",
  "generated_on": "2026-09-01",
  "primary_result": "STATIC SEAM QUALIFIED",
  "strongest_candidate_id": "SXDK-001",
  "pins": {
    "fable_start": { "branch": "fable2-native-renderer-g1.5-reference", "commit": "78c5d66807abf19f67966bd0c3d8301c29990ae4", "tree": "e1881f9de89824feb051b58300374c924747605b", "working_branch": "fable2-native-renderer-g1.6a-static-xdk-recovery" },
    "g1_accepted_base": { "commit": "c44e8c16f4422f9a828caf30899ac989170b8a8c" },
    "paused_g2a": { "branch": "fable2-native-renderer-g2a-forwarding-proof", "commit": "47c2ea2b7d9e14b09fd942c4b5f1bd11c46e2f51", "tree": "910e80108c2d9e7d8474866506f1c9e23ede601c", "incorporated": false },
    "tu1": { "title_id": "0x4D5307F1", "media_id": "0x716F0A0D", "version": "0.0.1.26", "base_xex_sha256": "88C4EF2E18E65409444D1B068EFF921D1F7E180A5AE64EDC64BA6B0872372662", "xexp_sha256": "046A05693B4DA4437083C784000A850858B3BF992955C7DB30D518FB3E53E41C", "loaded_image_sha256": "BF7300F7E0DEEE91444ACD50FBE69752F5CFD3CF51358186F1B849DF25A8CB00", "loaded_image_base": "0x82000000", "loaded_image_size": "0x01620000", "entry_point": "0x82CC21C0", "executable_fingerprint": "5C8B78B84C93028D166E3DF347206E6642BA40BF374AD1AF8D958B2211320357" },
    "rexglue": { "path": "C:/Dev/rexglue-sdk-v0.10", "branch": "fable2-v0.10-migration", "commit": "956c6a8b5da4c54b9899a2593e9c67c26de30194", "tree": "b78b06b8ac650467372236a3a262864e069a9382", "allowed_preexisting_status": [" m thirdparty/libmspack"] },
    "canary": { "path": "C:/Dev/Fable2NativeRendererResearch/xenia-canary", "branch": "canary_experimental", "commit": "3a44f20c7bc66db1da583e8a6f0ab740e31908e9", "tree": "c343b0a5796590fadc3b78c993bfada51e7e9148" },
    "active_gpu_plugin": { "path": "out/build/win-amd64-release/rexgpu-xenos.dll", "sha256": "8232051BED6E5CE99CF37B2EF581C824F58875C140A4D3C75DE14E8A5DF4AA99", "size": 2770944, "backend": "D3D12_ONLY" }
  },
  "analysis_inputs": [
    { "input_id": "INPUT-G15-CORPUS", "path": "docs/fable2-gpu-reference/", "provenance": "Committed G1.5A-D corpus at required start tree e1881f9de89824feb051b58300374c924747605b.", "status": "COMMITTED", "purpose": "Pins, relevance, ownership, seams, experiment criteria and open questions." },
    { "input_id": "INPUT-G1", "path": "docs/fable2-native-renderer/candidate-hook-inventory.json", "provenance": "Accepted G1 evidence descended from c44e8c16f4422f9a828caf30899ac989170b8a8c.", "status": "COMMITTED", "purpose": "Seed boundaries and dispositions." },
    { "input_id": "INPUT-PROVENANCE", "path": "tools/fable2-entrypoint-closure-evidence.json", "provenance": "Size 4768; SHA-256 10F9411631AE08D653FB1CDCA192E364CF499BB56948A6E72F93384632786CC7.", "status": "COMMITTED", "purpose": "Exact XEX/XEXP/loaded-image identity." },
    { "input_id": "INPUT-CLOSURE", "path": "out/analysis/BF7300F7E0DEEE91444ACD50FBE69752F5CFD3CF51358186F1B849DF25A8CB00/entrypoint-closure.json", "provenance": "Size 341019731; SHA-256 665CA2AE7ED65632B2E9F368063D3D9EE260E8DEF6F276B455CD62A9F2DCC397.", "status": "IGNORED LOCAL READ-ONLY", "purpose": "Authoritative .pdata ranges, direct edges and address-taken evidence." },
    { "input_id": "INPUT-GHIDRA", "path": "out/analysis/BF7300F7E0DEEE91444ACD50FBE69752F5CFD3CF51358186F1B849DF25A8CB00/ghidra-function-map.json", "provenance": "Size 96710692; SHA-256 03516B3A1F33433E493739418C9939D4FF1AEB0989F4ACEF2FD4D8204A077F58.", "status": "IGNORED LOCAL READ-ONLY", "purpose": "Independent entries, .pdata records and inbound references." },
    { "input_id": "INPUT-JUMPS", "path": "out/analysis/BF7300F7E0DEEE91444ACD50FBE69752F5CFD3CF51358186F1B849DF25A8CB00/jump-table-recovery.json", "provenance": "Size 81223154; SHA-256 B1FE26FB9119DAF7E7E0196CBDBA8CCA087BE190BF156FE0B12DF116379ED89A.", "status": "IGNORED LOCAL READ-ONLY", "purpose": "Recovered indirect control flow and negative reachability checks." },
    { "input_id": "INPUT-GENERATED", "path": "generated/default/fable2_recomp.*.cpp", "provenance": "codegen.d names assets/tu1/default.xex and fable2_manifest.toml; manifest SHA-256 E3EB39CA153E396D5DC53E6F943ED8FF7AF1D6B0704EB860836BD7D21A3F87B0.", "status": "IGNORED LOCAL READ-ONLY", "purpose": "Exact PPC, register, offset, call and import mappings." },
    { "input_id": "INPUT-REXGLUE", "path": "include/rex/graphics/xenos.h; src/graphics/command_processor.cpp", "provenance": "Read-only source at ReXGlue commit 956c6a8b5da4c54b9899a2593e9c67c26de30194.", "status": "PINNED READ-ONLY REFERENCE", "purpose": "PM4 SET_CONSTANT FETCH and texture-fetch-constant semantics." }
  ],
  "classifications": ["QUALIFIED REPRESENTATIVE METHOD", "STRONG STATIC CANDIDATE", "DISCOVERY LEAD ONLY", "REJECTED AS SEMANTIC SEAM", "RECOVERY BLOCKED"],
  "counts": {
    "candidates": 6,
    "by_classification": { "QUALIFIED REPRESENTATIVE METHOD": 1, "STRONG STATIC CANDIDATE": 2, "DISCOVERY LEAD ONLY": 1, "REJECTED AS SEMANTIC SEAM": 2, "RECOVERY BLOCKED": 0 }
  },
  "candidates": [
    {
      "candidate_id": "SXDK-001",
      "generated_name": "sub_82BA77D0",
      "boundary": { "start": "0x82BA77D0", "end": "0x82BA7894", "size": "0xC4", "instruction_count": 49 },
      "provenance": {
        "loaded_image_sha256": "BF7300F7E0DEEE91444ACD50FBE69752F5CFD3CF51358186F1B849DF25A8CB00",
        "boundary_authority": "trusted TU1 .pdata function range",
        "boundary_evidence": ["closure: trusted pdata [0x82BA77D0,0x82BA7894)", "Ghidra: entry 0x82BA77D0, pdata record 0x82137908", "generated: 49 instructions"],
        "generated_mapping": { "path": "generated/default/fable2_recomp.110.cpp", "sha256": "4168294DC783D211919D0D178732E50A8014CF8E750187BF66491437E7473C10", "size": 1035313, "start_line": 20979, "end_line": 21103, "generated_name": "sub_82BA77D0" }
      },
      "relation_to_prior_evidence": { "accepted_g1_candidates": [], "accepted_g1_cluster_relation": "New Xbox D3D method in the G1 static-library region.", "g1_5_divergence_ids": ["TEX-001", "TEX-002", "TEX-003"], "limitation": "No divergence reachability or causality is claimed." },
      "abi": {
        "register_arguments": [
          { "register": "r3", "entry_value": "device-state pointer", "use": "Reads +0x30/+0x38/+0x31AC; writes +0x30.", "confidence": "CONFIRMED" },
          { "register": "r4", "entry_value": "texture fetch slot", "use": "Multiplied by six for SET_CONSTANT FETCH index.", "confidence": "CONFIRMED" },
          { "register": "r5", "entry_value": "borrowed six-dword descriptor pointer", "use": "Reads +0x00..+0x14; normalizes address fields in dwords 1 and 5.", "confidence": "CONFIRMED" },
          { "register": "r6", "entry_value": "unused at entry", "use": "Overwritten.", "confidence": "CONFIRMED" },
          { "register": "r7", "entry_value": "unused at entry", "use": "Overwritten.", "confidence": "CONFIRMED" },
          { "register": "r8", "entry_value": "unused at entry", "use": "Overwritten.", "confidence": "CONFIRMED" },
          { "register": "r9", "entry_value": "unused at entry", "use": "Overwritten.", "confidence": "CONFIRMED" },
          { "register": "r10", "entry_value": "unused at entry", "use": "Overwritten.", "confidence": "CONFIRMED" }
        ],
        "stack_arguments": [],
        "implicit_inputs": [{ "value": "device[0x31AC]", "role": "packet-header bits", "confidence": "CONFIRMED" }],
        "return_behavior": { "description": "Void-like; callers ignore incidental final cursor in r3.", "confidence": "CONFIRMED" },
        "abi_stability": { "description": "Exact bounded r3/r4/r5 ABI; source-level method name unknown.", "confidence": "CONFIRMED" }
      },
      "persistent_state_offsets": [
        { "base": "r3 device", "offset": "0x30", "width_bits": 32, "access": "READ_WRITE", "inferred_role": "PM4 write cursor", "evidence": "Loaded and advanced to final emitted dword.", "confidence": "CONFIRMED" },
        { "base": "r3 device", "offset": "0x38", "width_bits": 32, "access": "READ", "inferred_role": "PM4 capacity boundary", "evidence": "Unsigned cursor comparison precedes overflow helper.", "confidence": "CONFIRMED" },
        { "base": "r3 device", "offset": "0x31AC", "width_bits": 32, "access": "READ", "inferred_role": "packet-header mode/predicate bits", "evidence": "ORed with 0xC0062D00.", "confidence": "PROBABLE" }
      ],
      "call_relationships": {
        "direct_callers": [
          { "address": "0x82BA7B28", "site": "0x82BA81CC", "relationship": "per-slot copy/scale fetch construction", "confidence": "CONFIRMED" },
          { "address": "0x82BA83C0", "site": "0x82BA85D8", "relationship": "slot-zero parallel copy path", "confidence": "CONFIRMED" }
        ],
        "indirect_or_callback_reachability": [{ "path": "sub_82BAA2B8 materializes 0x82BA8928 at 0x82BAA338; sub_82BA8928 -> sub_82BA7B28 -> SXDK-001", "confidence": "CONFIRMED" }],
        "direct_callees": [{ "address": "0x821E8EC0", "site": "0x82BA77FC", "relationship": "PM4 capacity/advance helper", "confidence": "CONFIRMED" }],
        "xbox_graphics_imports": []
      },
      "resource_ownership_and_lifetime": { "descriptor": "borrowed and synchronously copied", "device": "external owner", "gpu_memory": "external lifetime must extend through asynchronous consumption", "allocation_or_refcount": "none", "confidence": "CONFIRMED" },